756	f413a96a-17e5-4ed9-aeee-3cbc6b5367d8	social_and_political/political/political_instability	0.776	bring about a regime change	0				social_and_political/political/political_instability	0.774	about a regime change	0					cwms	As it has done with Sudan, Ethiopia and Somalia, the Eritrean regime plans to have an Eritrea-based Djiboutian opposition group that will either bring about a regime change or, short of that, at least pressure the government to meet its demands.
757	34c01f16-a0fe-40bb-b17a-ca029aad3e40	crisis_and_disaster/environmental_disasters/natural_disaster/drought	0.749	drought	0				health_and_life/birth	0.818	birth	0					hume	Prevailing drought also disrupted conception and birth and abnormally increased abortion and intensified loss of household assets.
758	bb4bfcd1-4186-44c9-ac6d-a9ddc8fd14bc	social_and_political/conflict	0.766	renewed fighting	0				social_and_political/conflict/tension	0.716	fears	0					hume	South Sudanese officials say 150,000 people have already fled Abyei and its surrounding areas over fears of renewed fighting.
759	96595ec8-8235-408f-ba9a-b02954a3e274	interventions/provision_of_goods_and_services/point_of_use_water_treatment_at_household_level	0.774	severely affect Egypts water security	1				access/water_access	0.755	water security	0					cwms	Al-Qousi added that a period of five or six years of storage in the GERD would severely affect Egypts water security level, adding that 12-18 years are needed to guarantee safety for Egypt.
760	7bd656a6-f711-40d5-983e-01a5f6c86cfc	economic_and_commerce/economic_activity/market/demand/food_demand	0.781	current production of cotton is not meeting the demand	0				economic_and_commerce/economic_activity/currency	0.761	huge amount is being imported with hard currency	0					eidos	Recent policy is directed at attracting foreign investment , pointing to a change in direction from the government , The textile industry has been a priority sector for the government but because the current production of cotton is not meeting the demand , a huge amount is being imported with hard currency .
761	4d6b6871-5541-46dc-908c-9657a54535f8	health_and_life/basic_needs	0.757	make greater contribution	0				trend	0.728	reduction	0					hume	In addition, China is also ready to share its technology and experience without any reservation with Africa, make greater contribution to poverty reduction and development, encourage more enterprises to participate in Africa's infrastructure construction, and strengthen cooperation in economy and trade, Li told the forum.
762	edd6b640-0f8e-4f05-84aa-3c1913c018b4	social_and_political/conflict/attack	0.858	death trying to flee when security forces fired tear gas into the crowd	0				social_and_political/conflict/attack	0.787	death trying to flee when security forces fired tear gas into the crowd	0					cwms	At least 52 people were were crushed to death trying to flee when security forces fired tear gas into the crowd.
763	08fde948-a504-4e56-a403-4e6465a7b8d3	health_and_life/basic_needs	0.749	better understand modern military strategy	0				economic_and_commerce/economic_activity/currency	0.741	money	0					eidos	Through mentoring , the American officers are able to help their Ethiopian counterparts better understand modern military strategy , which might save lives and money , Belachew said .
764	d70c2b43-5bf9-4709-9c09-560e3493601d	food_security/food_utilization	0.796	adapting highland fruits in the country to maximize the benefit of the people for local consumption	0				economic_and_commerce/economic_activity/currency	0.855	foreign currency	0					eidos	The government incorporates a strategy on adapting highland fruits in the country to maximize the benefit of the people for local consumption and to increase foreign currency from exporting high yields , he added .
765	df5d7319-21af-46ac-9b6f-f7926f4c1edf	interventions/provision_of_goods_and_services/provision_of_credit_and_training_for_income_generation	0.782	Limited technical and financial capacity	1				interventions/provision_of_goods_and_services/provision_of_credit_and_training_for_income_generation	0.749	technical and financial capacity	1					cwms	Limited technical and financial capacity as well as low awareness level of the public on biodiversity is among the bottlenecks facing the sector, Gemedo mentioned.
766	be48171d-3b8e-476a-b399-0e98731aa184	interventions/provision_of_goods_and_services/legal_aid_for_displaced_persons	0.853	by Sudan's former Humanitarian Aid Commissioner	1				interventions/provision_of_goods_and_services/legal_aid_for_displaced_persons	0.775	the initiative launched by Sudan's former Humanitarian Aid Commissioner	1					cwms	In a statement extended to Sudan Tribune on Tuesday, SPLM-N Secretary General Yasir Arman has welcomed the initiative launched by Sudan's former Humanitarian Aid Commissioner, Fath al-Rahman al-Gadi, in which he called to stop the war, address humanitarian issues and narrow gaps between the conflicting parties.
767	f8eef78c-1cc6-45db-ac0e-477b1d8d177f	interventions/institutional_support/capacity_building_of_national_authorities_on_human_rights	0.731	authorities	1				environmental/environment	0.856	to sell a stable economic environment	0					cwms	Indeed, authorities try to sell a stable economic environment, liberalized economy, security of investment, significant tax incentives, investment opportunities, favorable tax regime, access to large market, good infrastructure, strong natural resource base, and cheap labor force to potential investors.
768	55c3d5d3-8047-4d85-b50f-d211f621e477	interventions/provision_of_goods_and_services/cash_transfer	0.764	Direct cash aid	1				economic_and_commerce/economic_activity/market/revenue/farmer_income	0.778	income	0					eidos	Direct cash aid temporarily gives money to people to increase their income ( Icash , transfer ) .
769	99193948-ad38-41d2-bcf4-53c15b5a056a	health_and_life/basic_needs	0.763	needed	0				access/infrastructure_access	0.761	build	0					hume	UC health science graduate Mohamud Osman, who headed the study, said more support and engagement from local services was needed in order to build trust and cooperation between the refugee and local communities.
770	cc3b5635-8df1-4390-86a7-906f1947cd42	trend	0.883	trends	0				economic_and_commerce/economic_activity/market/price_or_cost/crop_price	1	coarse grains	0					hume	Prices of coarse grains followed mixed trends in may
771	f7bd7bd1-b3cc-482c-9980-06657ee6ea74	social_and_political/basic_services	0.705	services	0				health_and_life/basic_needs	0.767	benefit	0					hume	Clarity English gives nine universities in Ethiopia free software, while schools in Sudan also benefit from its services, with help from the UN.
772	8329c159-ef80-4098-9b9e-6fcc1b2435c1	economic_and_commerce/economic_activity/market/labor_market	0.753	Twenty companies operating in various industries	0				interventions/institutional_support/capacity_building_of_national_authorities_on_human_rights	0.703	the Public Authority for Investment Promotion and Export Development	1					cwms	Twenty companies operating in various industries used the opportunity provided by the Public Authority for Investment Promotion and Export Development (Ithraa) to interact with a number of Ethiopian firms, and discussed partnership opportunities at their business-to-business meetings.
773	ede04178-2071-4b6c-b386-e7653c7a8807	health_and_life/death	0.767	suicides	0				health_and_life/death	0.725	one death	0					sofia	Human Rights Watch documented an average of one death a week due to unnatural causes during which included suicides and falls from buildings .
774	a9055b56-8972-4151-8a9b-111755713963	social_and_political/conflict/war	0.947	war	0				social_and_political/conflict/attack	0.787	killed	0					hume	Relations between Ethiopia and Eritrea remain at odds after the two neighbours fought border war from 1998-2000 which has killed more than 70,000 people.
775	a461aab2-86ed-47ef-862b-16662259608b	economic_and_commerce/economic_activity/market/supply/food_supply	0.756	arrival of supplies from recent harvests	0				economic_and_commerce/economic_activity/market/supply/food_supply	0.812	improved local market supplies	0					eidos	The arrival of supplies from recent harvests have contributed to improved local market supplies , but have not been sufficient to offset the effects of the sharp depreciation of the Somoni ( TJS ) .
776	56a9b68e-645e-4d13-895a-f118690f574c	interventions/provision_of_goods_and_services/therapeutic_feeding	0.803	treat children at risk of infection	1				health_and_life/disease/human_disease	0.804	children at risk of infection	0					cwms	ADDIS ABABA, Jan 9 (Reuters) - Ethiopia is launching a national initiative in schools this year to treat children at risk of infection from parasitic worms, mirroring a programme in Kenya which has improved child health and school attendance, a charity involved said.
777	cc677287-f633-4e5d-9f79-e2d44acf0c6c	interventions/institutional_support/capacity_building_of_national_authorities_on_human_rights	0.786	only a small share of the countrys land potential	1				economic_and_commerce/economic_activity/market/assets	0.702	investments	0					eidos	Although the government increased investments in the expansion of land under irrigation , to date only a small share of the country ' s land potential has been tapped .
778	bb09b0df-b821-4416-a240-eeb8a9ee630a	crisis_and_disaster/environmental_disasters/natural_disaster/flooding	0.853	floods	0				crisis_and_disaster/environmental_disasters/crop_failure	0.803	loss	0					hume	It has been claimed that this flood management is beneficial as floods can lead to loss of life.
779	39e7aa1a-c798-4ba2-85b5-f5aefcdf7e6b	economic_and_commerce/economic_activity	0.783	infrastructural expansion	0				economic_and_commerce/economic_activity/development	0.72	successful economic development	0					hume	Besides the key role played by the agricultural sector, the country's successful economic development is attributed to infrastructural expansion such as construction of roads, educational institutions and health centres.
780	b5b630fa-57e2-4e32-a32a-50b7be8490b7	health_and_life/basic_needs	0.799	giving as much emphasis to regional integration	0				access/market_access	0.739	the market	0					cwms	Indeed, Lamin stated, during the release of the report for the Resident Representative's, that giving as much emphasis to regional integration will widen the market, expand the economy of scale and steer the country towards opening up.
781	23865ed1-b005-4cbd-b5f1-fc7eeb4cc2aa	economic_and_commerce/economic_activity/cross_border_trade/import	0.819	importing	0				social_and_political/criminal/abduction	0.807	arrested	0					hume	The two Tanzanians arrested for importing products illegally were caught on April 5, this year, at Holili border post.
782	b6836324-5162-4bc4-b9ee-44f3a964fb4b	agriculture/livestock_production	0.747	heat stress to livestock	0				agriculture/livestock_disease	0.795	mortality rate of herds, susceptibility of livestock to disease and emaciation	0					eidos	This has , in turn , increased the mortality rate of herds , susceptibility of livestock to disease and emaciation as a result of the long distances they travel in search of pasture and water ( Muluneh & Demeke , 2011 ) .
783	ae23d29e-8d57-4c83-90a8-bf59031392f0	social_and_political/conflict/tension	0.792	tensions	0				social_and_political/conflict/tension	0.792	grave concerns	0					hume	The situation is further compounded by grave concerns over rising tensions along ethnic lines.
784	be48171d-3b8e-476a-b399-0e98731aa184	interventions/provision_of_goods_and_services/legal_aid_for_displaced_persons	0.853	violence affecting the delivery of humanitarian assistance	1				interventions/provision_of_goods_and_services/legal_aid_for_displaced_persons	0.775	the delivery of humanitarian assistance	1					cwms	This monthly digest comprises threats and incidents of violence affecting the delivery of humanitarian assistance.
785	a4861d81-86ca-4b04-bc16-6fc3341bd5ec	economic_and_commerce/economic_activity	0.857	economy	0				crisis_and_disaster/crisis	0.953	crisis	0					hume	In late 2011 and early in 2012, Malawi s economy was affected by a severe foreign exchange crisis, resulting mainly from sharp declines in tobacco export prices, the suspension of foreign aid, and increased costs of fertilizer imports (distributed at subsidized prices to farmers; see Chapter 8).
786	a6177228-c3c5-4fa4-a768-b2ea9b6246b9	access/infrastructure_access/construction_materials	0.731	construction	0				economic_and_commerce/economic_activity/market/price_or_cost/cost_of_transportation	0.749	the transportation	0					hume	Hence apart from increasing the number of service providing vehicles in collaboration with the federal government the light rail transport under construction is expected to ease the transportation problem the city is going under.
787	e03f5424-be65-4b94-b43e-abe14e72af3f	social_and_political/political/sanction	0.702	ban	0				economic_and_commerce/economic_activity/competition	0.739	making	0					hume	Following Kat ban in the UK, Kenyan traders are making similar noises and asking their government to lobby with the UK government to reverse this latest ban.
788	d6a0ddd8-47be-43d4-b229-f3af482710b0	interventions/institutional_support/capacity_building_of_national_authorities_on_human_rights	0.702	The Security Council	1				social_and_political/political/sanction	0.798	sanctions	0					cwms	The Security Council subsequently tightened sanctions to include, among other things, coverage of Eritrea's extortion of the 2% tax' from members of the Eritrean Diaspora, the so-called Diaspora Tax, and the introduction of due diligence reports to avert possible misuse of the resources the government might obtain from the country's developing extractive industries.
789	eeda061c-24eb-4ee2-88bd-294eeb278acc	social_and_political/criminal/crime	0.763	acts of violence	0				health_and_life/death	0.778	premature death in Latin America	0					eidos	Road injuries and acts of violence were key contributors to premature death in Latin America and the Caribbean .
790	e9381e4c-2eee-4560-bab5-4733d276a597	social_and_political/conflict/hostility	0.807	conflict	0				social_and_political/conflict/hostility	0.767	violence	0					hume	The increase in authoritarianism and conflict has triggered violence and human rights abuses in the Horn of Africa, the African Great Lakes and the eastern part of the continent, Amnesty International said in its report released on Wednesday.
791	56adcabd-368e-49bf-a7e2-20ac6b4fbad0	social_and_political/threat/physical_insecurity	0.784	prevailing insecurity	0				social_and_political/government/census	0.852	survey Unity state	0					eidos	A major limitation for this study was the inability to survey Unity state , primarily due to the prevailing insecurity .
792	4d3c0041-67f7-495d-9ec3-e0044c6af52f	interventions/provision_of_goods_and_services/household_solid_waste_management	0.753	support their households	1				food_security/household_food_storage	0.719	their households	0					cwms	In 2006, Muir founded the South African-based Umzi Wethu programme, which targets vulnerable youth "that show resilience and ambition, but despair of opportunities to support their households", and gives them the skills and training they need to become highly employable young adults.
793	2ea7a503-7572-49b1-9e13-6b6b33e2a747	trend	0.776	improved global economic growth expectations and increased	0				crisis_and_disaster/economic/economic_crisis	0.843	global economic growth expectations	0					cwms	Ģ International crude oil and petroleum product consumption is expected to increase in 2018 due to improved global economic growth expectations and increased world trade (U.S. Energy Information Administration).
794	f6161d93-db0b-4b54-a774-de43ae99a7b8	social_and_political/government/regulation	0.733	by any genuine considerations of the rule of law	0				interventions/provision_of_goods_and_services/legal_aid_for_displaced_persons	0.824	have been motivated by any genuine considerations of the rule of law	1					cwms	"Any balanced examination of the situation would lead to the conclusion that this measure cannot have been motivated by any genuine considerations of the rule of law."
795	c416d5c4-93e1-4e00-b67d-1d964669d598	health_and_life/nutrition/food_intake	1	food	0				interventions/provision_of_goods_and_services/infant_and_young_child_feeding_support	0.72	When children are facing famine, because crops have failed	1					eidos	David Bull , UNICEF UK 's executive director , said : '' When children are facing famine , because crops have failed , because food is scarce , it 's time to share a little of what we've got .
796	a0ced41e-9be4-4f13-88b4-b7c48588a7fc	social_and_political/population_group/population_density	0.783	pressure on their limited resources to support displaced populations	0				interventions/provision_of_goods_and_services/legal_aid_for_displaced_persons	0.796	assistance	1					eidos	A small number of host community members will also require assistance due to pressure on their limited resources to support displaced populations .
797	1794f935-09ef-49ea-8239-3492ccab498c	environmental/meteorologic/precipitation/rainfall	0.977	heavy rains	0				crisis_and_disaster/environmental_disasters/natural_disaster	0.752	localized floods	0					hume	As of December 6, heavy rains in parts of the Gedo and Lower Juba regions in southern Somalia continued to cause localized floods, restricting road access and hampering the timely delivery of humanitarian assistance, according to OCHA.
798	24a0972b-c300-4294-9ba9-71ce83d5327e	interventions/provision_of_goods_and_services/provision_of_non_formal_education	0.772	being attended to by the relevant authorities.	1				interventions/institutional_support/capacity_building_of_national_authorities_on_human_rights	0.74	authorities	1					cwms	Their cases are being attended to by the relevant authorities."
799	7ddea136-36e3-4d5f-a26a-e887e23f2ddf	social_and_political/conflict/war	0.974	recent cross-border adventures	0				social_and_political/conflict/tension	0.726	fears	0					hume	Think of them as two siblings whose very closeness exaggerates their animosity - but remember that this family feud has already killed tens of thousands, and Ethiopia's recent cross-border adventures are raising fears of more violence to come.
800	e270dbbb-fe4e-48f0-bacc-f809efc1c24e	economic_and_commerce/economic_activity/market/price_or_cost/oil_price	0.975	price	0				economic_and_commerce/economic_activity/market/revenue/household_income	0.978	income	0					hume	A decline in price reduces producers income and reduces food security.
801	af23cf41-faa7-45d1-ae0d-0eba6276742f	agriculture/livestock_disease	0.851	contagious animal disease affecting small ruminants	0				agriculture/livestock_disease	0.757	animal disease affecting	0					cwms	The project is funded by the European Union under its SHARE program amounting 9.2 million Euros to implement a progressive control program for peste des petits ruminants (PPR), also known as sheep and goat plague, a highly contagious animal disease affecting small ruminants.
802	7876002f-42c2-4ab5-9eb8-1334d9688e88	economic_and_commerce/economic_activity/market/fuel	0.916	competitive international market	0				economic_and_commerce/economic_activity/market/price_or_cost/crop_price	1	prices	0					hume	However, the recent pastoralist growing interest to embrace drought-tolerant species (camel), in the prevailing circumstance of climate-induced growing local food insecurity, is evidently faced with the problem of soaring camel prices driven by competitive international market pressures.
803	d16f6bde-e81c-46f4-85f1-82fd8306fb9c	crisis_and_disaster/famine	0.862	2011 famine	0				health_and_life/death	0.714	died	0					hume	A lack of access to food aid was one of the main reasons 260,000 people died in Somalia's 2011 famine, also caused by drought and conflict.
804	d25b9def-33e6-478b-bd88-9930e6821b35	interventions/peacekeeping_and_security/conflict_mediation_and_political_dialogue	0.824	conflict started	1				interventions/peacekeeping_and_security/conflict_mediation_and_political_dialogue	0.818	the conflict started	1					cwms	Kiir and Machar met for the second time since the conflict started in mid-December.
805	4fa6d952-ace0-4cc7-90e0-77b4db99dbae	access/market_access	0.75	The company markets	0				economic_and_commerce/economic_activity/market/fuel	0.743	petroleum products	0					cwms	The company markets bulk petroleum products in crude oil and refined forms and LPG to various countries in East, Central and Southern Africa and in the Indian Ocean Islands.
806	7822d7dd-741f-4356-b034-fe6f43db1663	health_and_life/basic_needs	0.719	special efforts	0				agriculture/livestock_production	0.786	livestock production	0					hume	In terms of pastoral areas, special efforts are made to enhance specialization in livestock production and marketing through the provision of water supply for the community and their livestock as well.
807	0d870bcc-b7ca-4a0f-b800-f11113ce3f3f	environmental/pollution	0.749	Outdoor air pollution	0				health_and_life/death	0.838	3.7 million premature deaths	0					eidos	Outdoor air pollution is estimated to cause 3.7 million premature deaths annually .
808	6295e166-eb48-4cbc-9d34-3b3943a1b8cc	environmental/natural_resources	0.834	Africa's heavy dependence on natural resources and agriculture	0				environmental/climate_change_mitigation	0.864	repercussions of climate change here	0					eidos	Because of Africa 's heavy dependence on natural resources and agriculture , and because of limited capacities in many African communities , the repercussions of climate change here are particularly ominous .
809	92f2f04d-9edd-4ff4-9a38-e6c091e374aa	social_and_political/migration/migration_returnees	0.748	some IDPs that had returned to their area of origin	0				health_and_life/basic_needs	0.725	some IDPs that had returned to their area of origin have started to go back to Gedeo due to insecurity	0					cwms	However, OCHAs Gedeo-West Guji Displacement Crisis report from October 9th indicates that some IDPs that had returned to their area of origin have started to go back to Gedeo due to insecurity.
810	2683b05c-5196-4d9f-8402-e40e6b10314c	economic_and_commerce/economic_activity/market/price_or_cost/cost_of_living	1	high cost	0				trend	0.883	decreased	0					hume	About 25% of the respondents said that their farm lands have decreased due to high cost of inputs and shortage of rainfall that resulted in crop failure (Figure 4).
811	124fa3a5-11a4-4ba3-bae3-d40d8a9cb676	social_and_political/population_group	0.745	militant groups	0				social_and_political/conflict/hostility	0.779	violence	0					eidos	Diplomats and analysts say there could be potential for any militant groups to exploit sectarian divisions and trigger violence .
812	ed294e87-0d0f-471a-95fa-0e80409a8bf2	economic_and_commerce/economic_activity/development	0.727	role of agriculture in economic development	0				interventions/provision_of_goods_and_services/clinical_management_of_sexual_violence	0.753	research outcomes	1					eidos	Much of the early work on global food prospects , international agricultural trade , international mechanisms for supporting food security , and the role of agriculture in economic development led to research outcomes that were truly international public goods ( IPGs ) and that appealed to a broad audience , including international development agencies ; academia ; and policy makers in a few , mostly large , developing countries ( for example , India ) .
813	f1a3c6a5-d995-4e55-9cce-17b2fc2adfe0	social_and_political/government/regulation	0.733	The government	0				economic_and_commerce/economic_activity/market/labor_market	0.707	The government actively tried to evaluate the potential of creating this industry in the 1960s to early 1970s	0					cwms	The government actively tried to evaluate the potential of creating this industry in the 1960s to early 1970s.
814	2f267eba-f0e8-4546-bb24-ab6a2c77ad20	economic_and_commerce/economic_activity/market/food_stocks	0.747	is offloading food from the government reserves to regulate the prices	0				economic_and_commerce/economic_activity/market/price_or_cost/crop_price	0.747	the prices	0					cwms	The government has already imposed an export ban in an effort to reduce outflows and is offloading food from the government reserves to regulate the prices.
815	bc2e07d5-22dd-4a7c-9246-5d4b15b92f70	health_and_life/basic_needs	0.754	which would have seen him retain power through a political transition	0				access/infrastructure_access/electrical	0.805	power	0					cwms	While Gaddafi accepted the AU proposals, which would have seen him retain power through a political transition, he later reneged on an agreed ceasefire, leaving Zuma with egg on his face.
816	d1f7bd0a-31d6-4677-9180-bfc74202a4a0	economic_and_commerce/economic_activity/market/transaction	0.802	Indian investments	0				social_and_political/conflict/hostility	0.901	a major upsurge	0					hume	The envoy identified agriculture, textile, infrastructure and technology as key sectors where Indian investments in Ethiopia will see a major upsurge.
817	2b0d98c0-0c06-47d2-a577-50cc5c5fcf93	social_and_political/threat/physical_insecurity	0.75	lack	0				agriculture/livestock_disease	0.993	livestock deaths	0					hume	Areas normally producing surplus food in the Horn of Africa country's central Oromia region were also affected by shortages, the statement said, adding lack of water had decreased livestock production and caused livestock deaths in other pastoralist areas.
