228	82d4db9e-5961-4228-a1a7-ceca49ed8a9b	crisis_and_disaster/environmental_disasters/natural_disaster/drought	0.917	drought	0				social_and_political/conflict/tension	0.761	insecurity	0					hume	Conflicts in parts of Central, East and West Africa continue to severely stress food security conditions and undermine the agriculture sector, while drought in parts of EastAfrican has also intensified food insecurity.
229	e932fabb-694f-4c3f-8b59-4f6fd12f4a2f	economic_and_commerce/economic_activity/cross_border_trade/import	0.744	availability of imports from Burkina Faso, Mali, and Benin	0				economic_and_commerce/economic_activity/market/supply/food_supply	0.806	Staple food market supplies	0					eidos	Eastern basin ( Benin , Nigeria , Niger , and Chad ) : Staple food market supplies were average in May in the southwestern part of Niger due to the availability of imports from Burkina Faso , Mali , and Benin .
230	3597048f-824b-4a76-8b9a-15f212905c3a	interventions/provision_of_goods_and_services/human_rights_monitoring_investigation_and_reporting	0.707	Somaliland's track record of political stability and security	1				interventions/provision_of_goods_and_services/once_off_cash_transfer_to_facilitate_return	0.722	Somaliland to become a secured destination for international business	1					eidos	Ethiopia 's Minister of Finance and Economic Development , Ato Sufian Ahmed , said in a statement that the Government appreciated Somaliland 's track record of ' political stability and security ' which will help Somaliland to become a ' secured destination for international business ' .
231	71f846d7-e7e6-44df-a4fe-689c9006f5e8	social_and_political/threat/physical_insecurity	0.819	insecurity	0				interventions/provision_of_goods_and_services/once_off_cash_transfer_to_facilitate_return	0.729	Ten aid workers who were on a mission to Twic East at the same time temporarily suspended activities and returned to Juba	1					eidos	Ten aid workers who were on a mission to Twic East at the same time temporarily suspended activities and returned to Juba due to the insecurity .
232	07a1e6f6-2dfa-4eab-87a2-3c4a1ea849d9	economic_and_commerce/poverty	0.726	the dire poverty	0				economic_and_commerce/poverty	0.884	aided many Gulf countries in response to the dire poverty	0					cwms	According to unofficial reports, some 50 years ago, Ethiopia aided many Gulf countries in response to the dire poverty they were facing back then.
233	5a3ec01a-e3cf-4b0e-b29f-7fc635e84bce	social_and_political/migration/emigration	0.715	fleeing	0				interventions/peacekeeping_and_security/conflict_mediation_and_political_dialogue	0.818	conflict	1					sofia	The camps currently house around 130,000 refugees from Somalia , the majority fleeing the food crisis and conflict .
234	df13173c-2e7f-4d63-a599-3bd52e304ba7	interventions/provision_of_goods_and_services/point_of_use_water_treatment_at_household_level	0.808	it focused on intensive development of water wells to cope up with the drought impact across the region	1				interventions/provision_of_goods_and_services/point_of_use_water_treatment_at_household_level	0.807	was last year as it focused on intensive development of water wells to cope up with the drought impact across the region	1					cwms	According to him, this year's campaign is stronger than what was last year as it focused on intensive development of water wells to cope up with the drought impact across the region.
235	79f5e68d-424f-478c-a88c-1f9298710e73	crisis_and_disaster/economic/economic_crisis	0.799	country's severe economic crisis	0				economic_and_commerce/economic_activity/market/inflation	0.903	hyper-inflation	0					eidos	`` Unfortunately , the cholera epidemic has struck at a time when most Zimbabweans are unable to purchase salt and sugar , '' he said , referring to the country 's severe economic crisis that has caused hyper-inflation and the collapse of health systems .
236	711c0ade-7332-4911-97ce-3bbdffe03f56	interventions	0.711	policies	1				economic_and_commerce/economic_activity/market/labor_market	0.726	private-sector participation	0					hume	Accordingly, they encouraged the authorities to persevere with policies that safeguard macroeconomic stability, strengthen buffers, and foster private-sector participation in the economy.
237	ef58b14c-21be-4190-8c37-b94633b8fed4	crisis_and_disaster/famine	0.883	food insecurity becomes more severe	0				crisis_and_disaster/famine	0.868	that quality of children's diets worsens as food insecurity becomes more severe	0					cwms	Our findings also confirm evidence from multiple studies showing that quality of children's diets worsens as food insecurity becomes more severe (Rodriguez, MundoRosas, MendezGomez Humaran, PerezEscamilla, & ShamahLevy, 2017).
238	949df1b8-2aea-48c3-9427-d973e8a1658d	economic_and_commerce/economic_activity/market/supply	0.991	abundant supply	0				economic_and_commerce/economic_activity/cross_border_trade/export	0.97	monthly maize exports to Kenya	0					eidos	Nevertheless , monthly maize exports to Kenya were still higher at between 20,000 and 40,000 MT a month in the fourth quarter due to abundant supply , and relatively lower prices in Tanzania .
239	050a4be5-3156-4983-9471-1d96050359af	interventions/provision_of_goods_and_services/once_off_cash_transfer_to_facilitate_return	0.762	shift in cash transfers	1				economic_and_commerce/economic_activity/market/inflation	0.903	experiencing inflation	0					eidos	If so , which regions / woredas are at low vs. high risk of experiencing inflation due to a shift in cash transfers ?
240	aeddec03-cc4a-499b-9aa9-671eca413e1e	economic_and_commerce/economic_activity	0.783	Large private-sector investment	0				trend	1	growth	0					hume	Ethiopia's average annual headline inflation fell in August to 5.9%. Large private-sector investment, especially in the agro-industry sector, combined with public infrastructure development, is expected to drive real GDP growth in the coming years.
241	95a347f4-c90a-4ec8-99b1-4d3332f37a3b	interventions/provision_of_goods_and_services/food_for_work	0.801	led different research and study teams, and produced more than 70 researches	1				interventions/provision_of_goods_and_services/public_health_information_campaign	0.8	more than 70 researches	1					cwms	Professor Yifru Birhane is a well-known researcher who served in different universities, led different research and study teams, and produced more than 70 researches published in renowned journals, both individually and collectively.
242	db2cbc0c-00e1-4a23-9b64-7855ad28b748	interventions/provision_of_goods_and_services/newborn_and_childhood_essential_health_care_services	0.777	while giving birth to life	1				interventions/provision_of_goods_and_services/cash_for_work	0.814	while giving	1					cwms	Millions have been lifted out of poverty (with China leading the way), and we are hard at work to ensure that all children have access to education, that no woman die while giving birth to life, that the scourges of HIV, tuberculosis and malaria no longer become a death sentence to millions, and that all have access to health care, to water, sanitation and clean energy.
243	5b6cd00d-b12a-4063-9996-caf885210779	health_and_life/basic_needs	1	The New Times that they had	0				social_and_political/conflict/hostility	0.878	the fight against genocide ideology and denial	0					cwms	Alice Cyusa, the chairperson of Rwanda Diaspora Global Network (RDGN), told The New Times that they had stepped up the fight against genocide ideology and denial, especially in the UK.
244	53d14f45-c6c4-494d-bdfb-ede626ed0c84	economic_and_commerce/economic_activity/market/assets	0.725	LAND	0				social_and_political/government/regulation	0.717	regulatory framework governing rural land tenure and property rights (LTPR)	0					eidos	LAND will further deepen and broaden the policy , legal , and regulatory framework governing rural land tenure and property rights ( LTPR ) and expand its capacity-building support at all levels of government to ensure sustainability of past USAID investments .
245	3d01e9b5-cb10-469f-b0f9-1864f2435461	social_and_political/political/political_instability	0.903	to poverty and regional instability	0				social_and_political/conflict/tension	0.79	Unfortunately, unknown numbers of Ethiopian manuscripts are lost or destroyed every year due to poverty and regional instability	0					cwms	Unfortunately, unknown numbers of Ethiopian manuscripts are lost or destroyed every year due to poverty and regional instability.
246	63b9e78a-cd0a-492d-822a-f90aad7a5704	economic_and_commerce/economic_activity/market/assets	0.753	investments	0				interventions/teaching,_training_and_public_awareness/training_of_farmers_on_crop_spacing	0.713	smaller farmers	1					eidos	However , those investments may help smaller farmers if they finance value chains that integrate those producers or if they invest in financial institutions that operate with farmers and rural people ( Meyer 2011 ) .
247	8f113e24-8046-4f95-9a64-fabb2bbe5133	interventions/provision_of_goods_and_services/locust_control_operation	0.738	capital controls	1				economic_and_commerce/economic_activity/market/labor_market	0.706	developing countries with fewer linkages to private international financial markets	0					eidos	Those developing countries with fewer linkages to private international financial markets , due to capital controls or a lack of interest among private investors , appear to have a larger incidence of fixed pegs .
248	ec9800da-539b-43d0-bb5a-c6a1b5716b1a	social_and_political/conflict/hostility	0.977	arrival of mainly Nuer ethnic, a major source of military and political support to former South Sudan vice president-Riek Machar rebellion, into impoverished and troubled region	0				social_and_political/threat/physical_insecurity	0.749	tension and security concerns	0					eidos	In particular , the arrival of mainly Nuer ethnic , a major source of military and political support to former South Sudan vice president-Riek Machar rebellion , into impoverished and troubled region has increased tension and security concerns among local communities .
249	7de245f7-1325-490a-9477-e8f8ee03c096	environmental/meteorologic/precipitation/rainfall	0.977	rainfall	0				agriculture/livestock_production	1	average production	0					hume	Deyr rainfall is expected to support average production and normal livestock births and productivity in most areas, though flooding will likely cause crop losses in riverine and lowland areas.
250	a52e9349-968e-4dce-b249-54e99d1fc76e	interventions/provision_of_goods_and_services/provision_of_credit_and_training_for_income_generation	0.762	opportunities for all--especially for those most at risk	1				interventions/building_construction	0.73	build resilience	1					eidos	The Report makes the case that preventing shocks and promoting opportunities for all - - especially for those most at risk - - can effectively help reduce vulnerabilities and build resilience .
251	8a5eb984-7aaa-4b5d-8637-3c540bceabc8	economic_and_commerce/economic_activity/market/demand/food_demand	0.833	would have a significant impact on competitiveness of maize production in Ethiopia	0				economic_and_commerce/economic_activity/market/demand/food_demand	0.819	a significant impact on competitiveness of maize production in Ethiopia	0					cwms	Ģ investment in bulk transport and storage facilities, along with grades and standards, would have a significant impact on competitiveness of maize production in Ethiopia.
252	42dc4a06-c93d-43ba-a9a3-a178aa8206d3	access/market_access	0.786	options which enhance access	0				access/market_access	0.8	access	0					cwms	The regional Government should facilitate options which enhance access to land such as resettlement, expansion of soil and water conservation practice on farmlands and reclamation of degraded land to bring into production.
253	cca945c2-719f-4be5-9818-49fc01f5a8d1	crisis_and_disaster/economic/economic_crisis	0.91	to the crisis in that country	0				social_and_political/conflict/tension	0.767	the difficult circumstances due to the crisis in that country	0					cwms	The Ethiopian government said it is doing its level best for the safe return of Ethiopians living in Libya, in spite of the difficult circumstances due to the crisis in that country.
254	58ec96b7-b1d6-494a-afae-776fd79f1e66	health_and_life/basic_needs	0.767	increase in the agricultural workload of pregnant women is known	0				health_and_life/birth	0.735	risk of preterm birth	0					eidos	An increase in the agricultural workload of pregnant women is known to increase the risk of preterm birth , and researchers have suggested that bending and standing exacerbate this risk ( Owens et al. 2015 ) .
255	a0204f1a-1882-4180-90d8-d04ef54707fa	interventions/teaching,_training_and_public_awareness/training_of_farmers_on_weed_control	0.781	it controls, trains and arms the rebels	1				interventions/teaching,_training_and_public_awareness/training_of_farmers_on_weed_control	0.781	since it controls, trains and arms the rebels, Pitia was quoted saying	1					cwms	The next round of peace talks should be out of Ethiopia and Sudan should be excluded from being a mediator, since it controls, trains and arms the rebels, Pitia was quoted saying.
256	a84ccaba-4fab-4aee-a3e0-ad7adbc3e187	economic_and_commerce/economic_activity/market/supply/food_supply	0.771	agriculture, food processing, tourism, renewable energy	0				food_security/food_production	0.832	food processing	0					cwms	The UAE and the Republic of Ethiopia have stressed their quest to establish vigourous joint investment projects in Ethiopia in the sectors of industry, agriculture, food processing, tourism, renewable energy and mining.
257	35fbf7fd-933d-403e-ae98-ddf0eb1b7a8f	interventions/information_services/food_security_or_famine_early_warning_system	0.71	of the security problem	1				health_and_life/basic_needs	0.791	My movement is very limited because of the security problem.	0					cwms	My movement is very limited because of the security problem.
258	4914d210-c514-44dd-9687-6e11217ff1aa	social_and_political/conflict/strike	0.76	strike	0				social_and_political/political/sanction	0.74	sanctions	0					hume	The African Union (AU) and the international community have also warned the two South Sudanese leaders with sanctions if they failed to strike a final peace deal.
259	45973e94-d7f8-4241-9e4a-590159284e3c	interventions/building_construction/creation_of_temporary_water_points	0.778	These places were chosen because they have remarkable symbols on tracing ancient Christianity.	1				interventions/building_construction/creation_of_temporary_water_points	0.771	These places were chosen because they have remarkable symbols on tracing ancient Christianity	1					cwms	These places were chosen because they have remarkable symbols on tracing ancient Christianity.
260	277d72c6-bb31-4ee6-ba7b-60471a39dc2a	economic_and_commerce/economic_activity/market	0.903	retail prices	0				trend	0.883	mixed trends	0					hume	In the Dominican Republic, retail prices of red and black beans followed mixed trends in november but both types remained some 40 percent above their levels a year earlier following a decline in production as a result of drought-reduced plantings and yields, and import volumes that have not entirely covered domestic demand.
261	044c5305-945d-47b2-b3c0-4fafc69db939	environmental/meteorologic/weather	0.738	adverse weather	0				agriculture/livestock_production	0.802	production	0					hume	Civil conflicts continued to severely affect the food security of a number of countries, while adverse weather, in some cases linked to ElNi?o, curbed production in others, constraining food access and pushing consumer prices up.
262	edd6b640-0f8e-4f05-84aa-3c1913c018b4	social_and_political/conflict/attack	0.858	battle	0				social_and_political/conflict/attack	0.787	killed	0					hume	Two other Germans, two Austrians and a Hungarian national were killed in a gun battle between the rebels and government forces escorting the tourist group.
263	21a8571f-2ae5-4e9e-a049-79169dff7cea	social_and_political/conflict/terrorism	0.879	11 bombings	0				social_and_political/conflict/attack	0.926	killed	0					hume	Somalia's hardline Shebab militia fighting to topple the Western-backed government of President Sharif Sheikh Ahmed demonstrated their new regional dimension when they claimed July 11 bombings in Kampala that killed 76 people.
264	909191ae-90aa-4e7a-97c5-ced1231ddf34	interventions/provision_of_goods_and_services/food_for_assets	0.824	availability of local remaining stocks from the previous production year	1				food_security/food_availability	0.863	Regional staple food availability	0					eidos	Regional staple food availability was adequate in October due to the availability of local remaining stocks from the previous production year , as well as regional and international trade flows ( Figure 4 ) .
265	da4bdf38-6758-4b8b-a607-8ad6dc8e1d34	interventions/provision_of_goods_and_services/legal_aid_for_displaced_persons	0.723	aid agencies	1				interventions/information_services/food_security_or_famine_early_warning_system	0.797	a broken state, aid agencies have warned	1					cwms	South Sudan, which gained independence from Sudan four years ago now stands on the verge of becoming a broken state, aid agencies have warned.
266	dd46853e-c6e2-4e3e-ae04-23fb26b0b217	health_and_life/disease/human_disease	0.909	drought-related diseases such as cholera, measles and meningitis	0				health_and_life/disease/human_disease	0.729	reports that drought-related diseases such as cholera, measles and meningitis are spreading fast	0					cwms	There are reports that drought-related diseases such as cholera, measles and meningitis are spreading fast.
267	416972c8-00a9-48e4-8d07-d11f1dbff8c9	interventions/provision_of_goods_and_services/child_friendly_learning_spaces	0.747	this builds our capacities through experience sharing	1				interventions/institutional_support/capacity_building_of_national_authorities_on_human_rights	0.735	Cooperation between the two countries fosters confidence and promotes cooperation in exchange of data as this builds our capacities through experience sharing	1					cwms	Cooperation between the two countries fosters confidence and promotes cooperation in exchange of data as this builds our capacities through experience sharing, Motuma added.
268	320d23ac-e561-4b04-ac28-603657b4cf68	economic_and_commerce/economic_activity/market/revenue/household_income	0.789	vulnerable districts, benefiting 168 000 households as of October 2016	0				food_security/household_food_storage	0.771	168 000 households	0					cwms	Crop and vegetable seed interventions in the most nutritionally vulnerable districts, benefiting 168 000 households as of October 2016.
269	fae67562-5737-447e-925e-69b1e879ba19	interventions/provision_of_goods_and_services/food_for_work	0.712	rehabilitation and construction works of new sources	1				interventions/provision_of_goods_and_services/water_treatment_of_piped_water_supply	0.872	water supply	1					eidos	4 This includes people reached with ongoing water supply and services ( including trucking and installed sources such as hand pumps and piped water systems ) as well as those reached with water supply due to rehabilitation and construction works of new sources .
270	75da8cd3-1787-435f-a5ce-57f12ec0e9d9	food_security	1	food insecurity	0				social_and_political/population_group/population_density	0.808	displacement of affected populations	0					eidos	Without it , the agency said `` food insecurity could reach catastrophic levels for some families in the worst-affected areas '' and result in `` the displacement of affected populations .
271	11d35fd1-dfa2-4243-b7f0-0632c30ac0d2	economic_and_commerce/economic_activity/market/revenue/household_income	0.81	situation of Ethiopian citizens in the Saudi Arabia including salary payment	0				economic_and_commerce/economic_activity/market/revenue/household_income	0.813	salary payment	0					cwms	The agreement will change the working situation of Ethiopian citizens in the Saudi Arabia including salary payment, having a leave and protection from domestic abuses and human right violations by their employers, Liaison Officer with Ethiopias Embassy in Saudi Arabia, Temsegen Omar told ENA.
272	43c94583-6621-4207-9d52-9a9d53135ccc	economic_and_commerce/economic_activity/market/inflation	0.903	rising inflation	0				health_and_life/nutrition/food_intake	1	increased food prices	0					eidos	Moreover , low supplies of food in markets , rising inflation , and a decrease in the value of the Ethiopian birr against the U.S. dollar have contributed to increased food prices ; the prices of key staple food commodities -- such as maize , sorghum , teff , and wheat -- rose by approximately 20 percent between June 2018 and June 2019 , further limiting food access for populations reliant on markets , according to the UN World Food Program ( WFP ) .
273	2bbeaaf2-a4f9-4ff1-8725-e7e4d2090ce1	social_and_political/conflict/hostility	0.878	the five-year conflict	0				economic_and_commerce/economic_activity/market/budget	0.869	severe constraints	0					hume	However, the lingering impact of the five-year conflict is still resulting in severe constraints to food availability and access.16
274	40a7b979-cd53-4095-aabb-ac98f69bc29a	interventions/provision_of_goods_and_services/food_for_work	0.852	12.6% said that family members passed the whole day and night without eating anything because there was not enough food	1				food_security/food_utilization	0.941	eating anything because there was not enough food	0					cwms	Based on HFIAS questions, the findings revealed 31.6% households eat less than three times a day, 23.6% affirmed as did not have any food to eat, 20% of the household said that members went to sleep hungry, and 12.6% said that family members passed the whole day and night without eating anything because there was not enough food.
275	ba04e289-cc38-4a1d-8bb5-ab5a3ddea880	interventions/institutional_support/capacity_building_of_national_authorities_on_human_rights	0.792	heartening example of indigenous government and international partners succeeding	1				economic_and_commerce/poverty	0.884	poverty and mortality rates	0					eidos	Against the abject failure of international assistance in Somalia , Ethiopia is often held up as a heartening example of indigenous government and international partners succeeding in reducing poverty and mortality rates .
276	1e4163c8-238c-43a6-bd2e-1c9afc9f60a4	agriculture/livestock_disease	0.804	disease	0				health_and_life/death	0.883	the death	0					hume	Multi Peril Livestock Insurance in November 2010 to cover the death of livestock due to disease or accident.
277	eb90a893-86fa-41c8-814a-761727b113de	interventions/peacekeeping_and_security/border_patrols	0.788	keep its borders open	1				interventions/peacekeeping_and_security/border_patrols	0.755	its borders	1					cwms	But not only did it keep its borders open it kept the doors of the houses and the hearts of the people open.
278	e654e199-a218-411d-b00d-204286cd3902	environmental/pollution/climate_change	0.839	All this erosion and deforestation	0				environmental/natural_resources/soil	1	to land degradation, low soil fertility,	0					cwms	All this erosion and deforestation have led to land degradation, low soil fertility, and drying up of springs and streams.
279	a9321aab-0900-47c4-a19a-f9139dcfb1ca	economic_and_commerce/economic_activity/cross_border_trade/import/food_import	0.718	of imports	0				economic_and_commerce/economic_activity/market/demand/food_demand	0.754	mainly reflecting improved market supplies as a result of imports.	0					cwms	By contrast, in Costa Rica, prices of red and black beans declined mainly reflecting improved market supplies as a result of imports.
280	351344ec-314c-4ced-a6d5-1d2863631d58	economic_and_commerce/economic_activity/market/price_or_cost/crop_price	0.889	monthly wheat and rice prices	0				interventions/provision_of_goods_and_services/point_of_use_water_treatment_at_household_level	0.7	only 48% of the time	1					cwms	During this same period monthly wheat and rice prices moved in the same direction only 48% of the time.
281	b44dec3f-9e0b-43c3-a5e5-23cc3264a473	social_and_political/threat/disarmament	0.753	the implementation	0				social_and_political/conflict/tension	0.716	confusion	0					hume	In some Regions there remains confusion over the implementation of this provision.
282	894478ec-2df8-42d1-b897-463fd290dee0	economic_and_commerce/economic_activity/market/supply	0.991	supply	0				food_security	0.742	distribution	0					hume	Moreover, CREC has dug 19 wells and established over 20 water distribution sites to provide free water supply to villagers.
283	df13173c-2e7f-4d63-a599-3bd52e304ba7	interventions/provision_of_goods_and_services/point_of_use_water_treatment_at_household_level	0.808	Local people trust such predictions because the accuracy is high.	1				interventions/provision_of_goods_and_services/point_of_use_water_treatment_at_household_level	0.807	such predictions because the accuracy is high	1					cwms	Local people trust such predictions because the accuracy is high.
284	d16f6bde-e81c-46f4-85f1-82fd8306fb9c	crisis_and_disaster/famine	0.862	starvation	0				health_and_life/death	0.714	deaths	0					hume	The UN refugee agency on Tuesday warned that the risk of mass deaths from starvation among the people of Horn of Africa, Nigeria and Yemen is increasing amid severe drought.
285	07a1e6f6-2dfa-4eab-87a2-3c4a1ea849d9	economic_and_commerce/poverty	0.726	to poverty	0				economic_and_commerce/poverty	0.884	to migrate due to poverty	0					cwms	Girls are pushed to migrate due to poverty, a lack of employment opportunities considered 'appropriate' for girls in Ethiopia, limited access to formal education, and the comparatively high remittances afforded by domestic work in the Gulf.
