465	b65c079d-243f-40f5-9b5f-534734ba4007	social_and_political/conflict/hostility	0.878	the violence	0				social_and_political/conflict/attack	0.787	killed	0					hume	In April, a government-sanctioned investigation said 669 people had been killed during one period in the violence and more than 29,000 people arrested
466	8295b0ab-dc6f-4449-bea6-1c932a964081	interventions/provision_of_goods_and_services/infant_and_young_child_feeding_support	0.719	mothers bringing their children in and getting an arm measurement	1				interventions/provision_of_goods_and_services/infant_and_young_child_feeding_support	0.723	their children	1					cwms	He said: "The strongest thing that I saw was mothers bringing their children in and getting an arm measurement.
467	8a2a33b6-9a15-441e-b5d9-b43f11f721dc	interventions/provision_of_goods_and_services/public_health_information_campaign	0.804	the new government is setting up a	1				health_and_life/basic_needs	0.813	requested help in rebuilding its institutions because the new government is setting up a	0					cwms	Somalia has requested help in rebuilding its institutions because the new government is setting up a federation, which is the governing system also used by Ethiopia.
468	5af0034c-7b87-4af4-bebb-4d909c6ce491	social_and_political/government	1	government	0				interventions/provision_of_goods_and_services/family_reunification_of_separated_children	0.8	children join their adoptive parents by allowing their adoption cases to continue moving forward	1					eidos	However , for cases already underway on April 21 , we ask your government to help these children join their adoptive parents by allowing their adoption cases to continue moving forward .
469	afdef25e-8ae0-4af5-a03f-2ac0ac1ba16e	economic_and_commerce/economic_activity/cross_border_trade/export/food_export	0.76	outlook for key food crops across the African continent under climate change is mostly negative and indicates	0				health_and_life/nutrition/food_intake	1	food prices	0					eidos	The outlook for key food crops across the African continent under climate change is mostly negative and indicates that low productivity , together with increasing global demand , will likely drive up food prices ( Jalloh et al. 2013 ; Waithaka et al. 2013 ; Hachigonta et al. 2013 ) .
470	e67a1f64-3fc0-40e7-b1fb-e8db6b61caf0	interventions/peacekeeping_and_security/conflict_mediation_and_political_dialogue	0.788	Welcoming the progress made by Member States in deepening and consolidating the democratic culture and practice through the holding of periodic credible elections, the Council noted that in that way	1				social_and_political/conflict	1	conflicts	0					eidos	Welcoming the progress made by Member States in deepening and consolidating the democratic culture and practice through the holding of periodic credible elections , the Council noted that in that way they prevent conflicts and promote sustainable peace , security , stability and development in their countries .
471	4ccdec7b-5cd0-4197-8af5-2cf838d83d37	health_and_life/basic_needs	0.769	countries in sub-Saharan Africa need	0				social_and_political/conflict/attack	0.789	battle	0					eidos	According to the global 2014 Human Development Report , countries in sub-Saharan Africa need to intensify their battle against deprivation and prevent crises from setting back recent development advances .
472	d7a5425f-3dc6-4d36-aaf7-6215774f467b	crisis_and_disaster/environmental_disasters/natural_disaster/drought	0.949	the ongoing drought	0				health_and_life/basic_needs	0.972	need	0					sofia	The announcement came amid Ethiopia 's battle with the ongoing drought that hits parts of the east African country affecting 7.8 million Ethiopians in need of emergency food aid .
473	ae23d29e-8d57-4c83-90a8-bf59031392f0	social_and_political/conflict/tension	0.792	to few economic opportunities, political persecution, and ecological stress	0				social_and_political/conflict/tension	0.792	Hundreds of thousands of refugees are fleeing the region due to few economic opportunities, political persecution, and ecological stress	0					cwms	Hundreds of thousands of refugees are fleeing the region due to few economic opportunities, political persecution, and ecological stress.
474	8c04ea0d-6a1d-42f8-9728-58a35b5f867a	crisis_and_disaster/environmental_disasters/crop_failure	0.795	the harvest	0				economic_and_commerce/economic_activity/market/price_or_cost/crop_price	1	prices	0					hume	Staple food prices increased atypically in Sudan during the harvest due to deteriorating economic conditions.
475	b570f2e9-c414-4a87-b621-dbc06a2e0b7a	environmental/natural_resources	0.834	depletion of resources	0				access/water_access	0.772	increased competition and conflicts over pasture and water resources	0					eidos	In Borana , this is also leading to increased competition and conflicts over pasture and water resources .
476	6b8e2177-2050-4337-90aa-8989dec01bf4	interventions/provision_of_goods_and_services/provision_of_credit_and_training_for_income_generation	0.727	educated workforce, an adequate budget, the latest technology	1				social_and_political/government/regulation	0.733	legal frameworks	0					eidos	This calls for institutions to have an educated workforce , an adequate budget , the latest technology and enabling legal frameworks .
477	7fb8170f-2123-4b88-a8c0-da9d4fb9fa98	interventions/provision_of_goods_and_services/public_health_information_campaign	0.704	other relevant Organizations operating in the social sector	1				economic_and_commerce/economic_activity/development	0.798	the social sector	0					cwms	The Assembly also mandated the African Union Commission, the NEPAD Agency, in collaboration with UNECA, AfDB, UNDP and other relevant Organizations operating in the social sector to support the activities of the HLC," she indicated.
478	83267bb9-f1b7-4efe-96e8-b57e125bb70f	social_and_political/government/regulation	0.795	U.S. laws	0				environmental/natural_resources	0.834	resources	0					eidos	We hope this guidance will clarify that aid workers who are partnering with the U.S. Government to help save lives under difficult and dangerous conditions are not in conflict with U.S. laws and regulations that seek to limit the resources or to eliminate resources flowing to al-Shabaab .
479	866e794b-b654-456c-b7af-6a7122484c63	access/infrastructure_access/electrical	0.724	will not only be capable of saving energy but will also produce power	0				access/infrastructure_access/electrical	0.722	energy	0					cwms	Although the MABR technology is already on the market, Emefcy is also developing an Electrogenic Bio Reactor, which the company says will not only be capable of saving energy but will also produce power.
480	d689e318-27c9-4fc2-b6b3-c97c76dda7e2	interventions/information_services/food_security_or_famine_early_warning_system	0.714	to security restrictions to some affected areas	1				interventions/provision_of_goods_and_services/human_rights_monitoring_investigation_and_reporting	0.816	Due to security restrictions to some affected areas, researchers could not establish the full scale of abuse	1					cwms	Due to security restrictions to some affected areas, researchers could not establish the full scale of abuse.
481	183a1606-626b-4ee6-9e61-3e2af83487d0	economic_and_commerce/economic_activity/cross_border_trade	0.909	Additional border crossings and long distances from the market	0				economic_and_commerce/economic_activity/market/price_or_cost/cost_of_transportation	0.969	total expenses for the transport services	0					eidos	Additional border crossings and long distances from the market substantially increase the total expenses for the transport services .
482	70f9ede1-5fd5-471a-a076-1f60e80cacdb	economic_and_commerce/economic_activity/market/assets	0.817	power investments, or capital	0				economic_and_commerce/economic_activity/market/assets	0.753	investments, or capital	0					cwms	Next to large-scale projects such as the two major hydro power investments, or capital intensive projects such as the development of a high speed train to facilitate import and export, impact investors with their longer-term investment outlook and desire to achieve both financial and social returnshave the potential to play a benign role in the investment landscape.
483	48431954-828b-487f-9a00-3f6a0567492b	social_and_political/conflict/hostility	0.884	the ongoing conflict	0				economic_and_commerce/economic_activity/market/fuel	0.8	markets	0					hume	In Nigeria, the depreciation of the Naira (NGN), official and unofficial restrictions on trade, and the ongoing conflict in the northeast continues to disrupt domestic and cross border staple food, cash crop, and livestock markets (Figure 5).
484	8e401d2a-6492-4bb1-8fe4-35add0b40712	interventions/institutional_support	0.78	funding to a technical support unit	1				interventions/provision_of_goods_and_services/public_health_information_campaign	0.791	people's awareness about health and nutrition program guidelines	1					eidos	DFID 's financial support to the Odisha government for the health and nutrition sector was substantial - 99 million UK pounds over an eight year period between 2008 and 2015 , The model of spending included direct budget support to the Odisha government as well as funding to a technical support unit that worked closely with the government ( Department for International Development , n.d ) Civil Society and NGOs in the state have also been credited with raising people 's awareness about health and nutrition program guidelines and for having conducted social audits of ICDS that have been helpful to the state .
485	a68bdbf1-3045-4b75-a489-1729986e20cc	environmental/meteorologic/weather	0.739	to suitable weather conditions	0				interventions/provision_of_goods_and_services/point_of_use_water_treatment_at_household_level	0.721	The increment of the production is due to suitable weather conditions	1					cwms	The increment of the production is due to suitable weather conditions, active participation of farmers, and use of modern agricultural systems and machineries including combiners at large, it was noted.
486	7225af40-51c9-47e1-b846-37c786c593d6	agriculture/livestock_production	1	general low production	0				economic_and_commerce/economic_activity/market/supply	0.991	supply	0					hume	Despite general low production, joint investment ventures and power sharing are set to boost supply in Burundi and Rwanda, while Kenya, Tanzania and South Sudan are anticipating integration into the Ethiopian grid.
487	0d6bbf2b-8ee3-46cf-be9d-3c7c845de626	environmental/climate_change_mitigation	0.728	the impact	0				movement/evacuate_humanitarian_workers	0.829	assistance	0					hume	I assume most of you are aware that this is the worst El Nino in history, and it has affected the African continent, in fact the whole world, but the African continent in particular, no country more dramatically than Ethiopia, where 11 million people are in need of assistance because of the impact of what is a very severe drought.
488	41a42160-0a51-406e-8aa0-e2886b3a4b8d	food_security/food_utilization	0.85	improve food production in the region	0				health_and_life/nutrition/food_intake	1	food production	0					cwms	In order to get an impression of promisin g options and possible constraints, with the help of the policy dialogue model PODIUM, this paper analyses the development of water management scenarios to improve food production in the region.
489	857eb1e5-ca63-4926-ac7f-c468427e6cb2	interventions/provision_of_goods_and_services/family_reunification_of_separated_children	0.794	My family made me marry him, because I was no longer pure.	1				interventions/provision_of_goods_and_services/family_reunification_of_separated_children	0.791	My family made me marry him, because I was no longer pure	1					cwms	My family made me marry him, because I was no longer pure.
490	cdcabab4-8c8d-4a4e-9931-6a9bc648f6dc	interventions/provision_of_goods_and_services/reporting_and_verification_of_child_rights_violations	0.796	problem of unavailability of any official document to indicate childrens birth date	1				interventions/provision_of_goods_and_services/child_friendly_learning_spaces	0.747	ages for the great majority of the sample children were determined using the local event calendar	1					eidos	Due to the problem of unavailability of any official document to indicate children ' s birth date , the ages for the great majority of the sample children were determined using the local event calendar .
491	789f431e-23e7-41ee-ba7f-cbb50a2745f9	social_and_political/government/regulation	0.765	Such a deliberate policy by the UNHCR	0				social_and_political/migration/human_migration	0.7	the gates of illegal migration of the youth from Eritrea and Ethiopia	0					cwms	Such a deliberate policy by the UNHCR opens the gates of illegal migration of the youth from Eritrea and Ethiopia.
492	ce743c47-1411-48f4-bb65-7834bd75cb51	interventions/institutional_support/capacity_building_of_national_authorities_on_human_rights	0.708	to its importance	1				interventions/provision_of_goods_and_services/provision_of_credit_and_training_for_income_generation	0.818	Education is an important measure of human capital due to its importance to secure employment and skills for managing scarce resources	1					cwms	Education is an important measure of human capital due to its importance to secure employment and skills for managing scarce resources (Saenz and Morales 2005).
493	36a4359a-517d-4799-b3f1-ca2c4fa4632a	economic_and_commerce/economic_activity/cross_border_trade/import/food_import	0.726	imports	0				economic_and_commerce/economic_activity/market/supply/food_supply	0.718	wheat supply	0					sofia	See Table 4.6 ( change in wheat supply due to imports ) .
494	908eb9c9-8e10-4c9e-aac8-8770de0c2489	interventions/provision_of_goods_and_services/communicable_disease_outbreak_control	0.801	other challengesincluding seasonal flooding, localized intercommunal conflict, above-average food prices, disease outbreaks, and limited access to health and WASH services	1				interventions/provision_of_goods_and_services/assessment_and_triage_of_health_facilities	0.713	ongoing complex emergency	1					eidos	In addition to drought , populations across Ethiopia confront other challenges -- including seasonal flooding , localized intercommunal conflict , above-average food prices , disease outbreaks , and limited access to health and WASH services -- that contribute to sustained humanitarian needs and an ongoing complex emergency .
495	b4a0f331-e7fb-4a78-bee3-90e156ffb0c0	health_and_life/basic_needs	0.726	practical reasons	0				social_and_political/government	0.781	Sudanese government	0					eidos	It said the Sudanese government attributed this to practical reasons and was not taking sides .
496	65f1c1c7-6d86-4504-9962-147fc1e70aa1	social_and_political/conflict/demonstrate	0.728	by the protests	0				social_and_political/conflict/demonstrate	0.872	the town which was heavily affected by the protests	0					cwms	One local resident said calm appears to have been restored to the town which was heavily affected by the protests, However the arrests and repression under the state of emergency continue, he said.
497	908eb9c9-8e10-4c9e-aac8-8770de0c2489	interventions/provision_of_goods_and_services/communicable_disease_outbreak_control	0.801	other challengesincluding seasonal flooding, localized intercommunal conflict, above-average food prices, disease outbreaks, and limited access to health and WASH services	1				interventions/provision_of_goods_and_services/assessment_and_triage_of_health_facilities	0.713	ongoing complex emergency in Ethiopia	1					eidos	While drought remains a major contributor to vulnerability in Ethiopia , negatively affecting the lives and livelihoods of farmers and pastoralists , populations also continue to confront other challenges -- including seasonal flooding , localized intercommunal conflict , above-average food prices , disease outbreaks , and limited access to health and WASH services -- that contribute to sustained humanitarian needs and an ongoing complex emergency in Ethiopia .
498	42dc4a06-c93d-43ba-a9a3-a178aa8206d3	access/market_access	0.786	you can't gain access	0				access/market_access	0.8	because you can't gain access", she pointed out	0					cwms	Rodriguez warned of the difficulties that humanitarian actors are experiencing in accessing certain areas of the Horn of Africa -"from the south of Somalia there is no real information because you can't gain access", she pointed out-, and of the need to open humanitarian corridors which would allow aid to arrive.
499	0e741469-9902-4962-9e4d-16bab3e9c4ba	interventions/provision_of_goods_and_services/provision_of_credit_and_training_for_income_generation	0.841	Supporting female holders participation in commercial and economically valuable crops	1				interventions/provision_of_goods_and_services/cash_for_assets	0.826	cash earnings	1					eidos	Supporting female holders ' participation in commercial and economically valuable crops can increase their cash earnings and investment on productivityenhancing technologies and tools .
500	7933155b-760a-4250-b254-26b1fcf71465	interventions/provision_of_goods_and_services/cash_for_work	0.774	got to try and work within that system	1				interventions/provision_of_goods_and_services/food_for_work	0.792	and work	1					cwms	And whatever system you have got, you have got to try and work within that system.
501	08fc0077-2e92-4c67-8171-ec4aa1fa3cfa	food_security/food_stability	0.74	instability	0				social_and_political/migration/human_migration	0.817	recent influx of forced migration	0					eidos	In response to the recent influx of forced migration due to instability in South Sudan , a `` Support Programme to the Refugee Settlements and Host Communities in Northern Uganda '' ( 10 million ) under the Regional Development and Protection Programme ( RDPP ) will scale up an on-going project in Uganda aiming to sustainably address the developmental needs of South Sudanese refugees and host communities in Northern Uganda .
502	77906333-44c6-44f8-80da-f81f3203ca5c	social_and_political/government/regulation	0.733	The government	0				social_and_political/conflict/demonstrate	0.705	The government said the pair went to a mosque and tried to incite violence	0					cwms	The government said the pair went to a mosque and tried to incite violence.
503	25d77f87-7e0a-4d96-97c9-1dd5c503aafc	economic_and_commerce/economic_activity/development	0.784	agricultural services project	0				social_and_political/migration/migration_returnees	0.747	return displaced people to their homes	0					eidos	`` I am also going to take a look at one that we just funded , an agricultural services project that helps to return displaced people to their homes .
504	b19f2300-3d8d-4cca-ba39-a04533a6e382	economic_and_commerce/economic_activity/livelihood/farming	0.746	differences in farming activities related to farm land size	0				wm/concept/time/temporal/season	0.785	four tabias in both seasons	0					eidos	Significant differences were observed across the four tabias in both seasons due to differences in farming activities related to farm land size , water availability , livestock ownership , and off / non-farm job opportunities , which are influenced by proximity to urban centres .
505	c53de2c4-cf80-47cd-b19b-92c38223ca78	social_and_political/conflict/war	0.855	allied militias	0				health_and_life/basic_needs	0.775	number of people, including a teacher in Beletweyne, Abdirahman Muhumed-Nur Abdulle, known	0					eidos	In the ensuing hours , Ethiopian troops and allied militias arrested a number of people , including a teacher in Beletweyne , Abdirahman Muhumed-Nur Abdulle , known as `` Matan .
506	468cfaea-dc30-4ee8-92ce-c2c5211d0f55	interventions/provision_of_goods_and_services/provision_of_credit_and_training_for_income_generation	0.713	to the provision of the directive, banks that are operating in the market are to meet the thresholds within five years, until June 2016	1				access/market_access	0.802	the market	0					cwms	According to the provision of the directive, banks that are operating in the market are to meet the thresholds within five years, until June 2016.
507	7c32eb8e-9aa8-4088-94b7-ea59ed03c1c8	interventions	0.711	self-defeating beggar-thy-neighbor policies	1				economic_and_commerce/economic_activity/market/price_or_cost/oil_price	0.975	the price	0					hume	Overall, for all parties involved, stronger WTO disciplines may act as a coordinating device to avoid self-defeating beggar-thy-neighbor policies in which all countries exacerbate the price spike and price volatility by trying simultaneously to insulate their own domestic market (Martin and Anderson 2011).
508	5cb5027e-7e6d-47ed-8269-892ad7d77684	environmental/natural_resources/pasture	0.804	conditions	0				economic_and_commerce/economic_activity/market/revenue/household_income	0.978	income	0					hume	Although improved livestock body conditions and producitivity have improved household income from the sale of livestock and related product, income form this source is not sufficient to fully supplement household needs in terms of income and food access.
509	0dfd155c-4c3d-4589-8026-dd681fea5f47	social_and_political/government/regulation	0.733	Policy and Practice	0				interventions/provision_of_goods_and_services/clinical_management_of_sexual_violence	0.768	Risk Management Policy and Practice, WASH	1					cwms	Agriculture and Food Security, Economic Recovery and Market Systems, Health, Humanitarian Coordination and Information Management, Logistics Support and Relief Commodities, Nutrition, Risk Management Policy and Practice, WASH Countrywide $76,805,243
510	b3ca29a3-e99f-419e-8da8-05ea3e39f90b	interventions/peacekeeping_and_security/conflict_mediation_and_political_dialogue	0.724	Special Envoys urged the Parties to fully cooperate with the MVM and abide by the Cessation of Hostilities Agreement, show their political will and commitment	1				social_and_political/conflict/war	0.974	war	0					eidos	The Special Envoys urged the Parties to fully cooperate with the MVM and abide by the Cessation of Hostilities Agreement , show their political will and commitment to end the war ; and facilitate and support the smooth operation of humanitarian assistance .
511	87f7eacf-9eef-4c27-84c8-4a5ea3cb2f08	economic_and_commerce/economic_activity/market/supply	1	ample supply	0				economic_and_commerce/economic_activity/cross_border_trade/export/food_export	0.775	Ģ International wheat prices	0					eidos	* International wheat prices fell in most markets due to ample supply and favorable prospects for the 2017 harvest , despite concerns of less than ideal weather conditions for some major producers in the northern hemisphere .
512	40afc7a8-78ad-4bf8-8bf0-33217dc0da0f	interventions/provision_of_goods_and_services/provision_of_non_formal_education	0.702	IGAD's consultations with the African Union and United Nations implies that the region has	1				interventions/peacekeeping_and_security/conflict_mediation_and_political_dialogue	0.799	way for a concerted effort to bring forward the dialogue	1					eidos	IGAD 's consultations with the African Union and United Nations implies that the region has to lead the way for a concerted effort to bring forward the dialogue to solve South Sudan 's problem .
513	b65c079d-243f-40f5-9b5f-534734ba4007	social_and_political/conflict/hostility	0.878	the violence	0				social_and_political/conflict/attack	0.787	killed	0					hume	At least eight people have been killed in the violence in the English speaking Cameroon regions, according to the government, although human rights watchdog Amnesty International says the death toll has reached 17.
514	707817c5-f2ff-40a4-8bf4-a86a095ba61f	crisis_and_disaster/crisis	0.88	change ĢRisk of natural disasters	0				crisis_and_disaster/crisis	0.72	ĢRisk of natural disasters	0					cwms	Threats ĢClimate change ĢRisk of natural disasters ĢPopulation growth/demographics data on who and where vulnerable populations residecan help to accelerate progress.
515	5165a539-5e61-4be2-966e-3b1e070f7ca2	interventions/provision_of_goods_and_services/cash_transfer	0.75	One reason for the prevalence of cash transfers in Tigray	1				economic_and_commerce/economic_activity/market/labor_market	0.732	off-farm employment opportunities	0					eidos	One reason for the prevalence of cash transfers in Tigray could be high levels of public and private investment in the region in recent years , which has stimulated economic growth that ' trickles down ' to villagers through remittances , improved off-farm employment opportunities , and more demand for locally produced goods and services .
516	c2ccb45c-7f72-4be1-9aba-7231bdadc0e4	social_and_political/migration/emigration	0.756	refused permission to relocate to the Middle Eastern country	0				social_and_political/migration/emigration	0.759	permission to relocate to the Middle Eastern country	0					cwms	Some 90,000 Ethiopians of Jewish extractions have been repatriated to Israel since 1948 when the state was founded while at least 12, 000 members of the Falash Mura community have been refused permission to relocate to the Middle Eastern country.
517	3435d012-3b3a-48c0-8906-3a546b8e332b	health_and_life/basic_needs	0.703	EPRDF has power in all the regions	0				interventions/provision_of_goods_and_services/locust_control_operation	0.804	controls all matters	1					eidos	The report stated that despite the structure crafted for decentralised administration , because the EPRDF has power in all the regions , it controls all matters .
